[
  {
    "key": "cyberpunk/concrete/poor",
    "alignment": "tile",
    "append": true,
    "variantId": "3",
    "description": "board formed concrete surface with timber plank grain and tie holes, stained dull grey",
    "seed": 3400
  },
  {
    "key": "cyberpunk/concrete/mid",
    "alignment": "tile",
    "append": true,
    "variantId": "3",
    "description": "board formed concrete surface with timber plank grain and tie holes, even grey",
    "seed": 3410
  },
  {
    "key": "cyberpunk/concrete/rich",
    "alignment": "tile",
    "append": true,
    "variantId": "3",
    "description": "sandblasted concrete surface with exposed fine aggregate, warm pale grey",
    "seed": 3420
  },
  {
    "key": "cyberpunk/concrete/high_rich",
    "alignment": "tile",
    "append": true,
    "variantId": "3",
    "description": "polished terrazzo concrete surface with fine stone chips, cool graphite",
    "seed": 3430
  }
]
