[
  {
    "key": "cyberpunk/floor-slab/poor",
    "aliases": [
      "cyberpunk/balcony-slab/poor"
    ],
    "alignment": "tile",
    "description": "stained cast concrete floor slab surface, oil spots, cracks filled with grime, dull grey",
    "tiling": {
      "worldSize": [
        3,
        3
      ]
    },
    "physical": {
      "roughnessFactor": 0.9,
      "metallicFactor": 0
    },
    "finish": {
      "grain": 0.25,
      "relief": 2
    },
    "variants": 2
  },
  {
    "key": "cyberpunk/floor-slab/mid",
    "aliases": [
      "cyberpunk/balcony-slab/mid"
    ],
    "alignment": "tile",
    "description": "cast concrete floor slab surface, light wear and faint scuffing, even grey",
    "tiling": {
      "worldSize": [
        3,
        3
      ]
    },
    "physical": {
      "roughnessFactor": 0.8,
      "metallicFactor": 0
    },
    "finish": {
      "grain": 0.2,
      "relief": 2
    },
    "variants": 2
  },
  {
    "key": "cyberpunk/floor-slab/rich",
    "aliases": [
      "cyberpunk/balcony-slab/rich"
    ],
    "alignment": "tile",
    "description": "polished terrazzo floor surface seen straight from above, small marble chips in light grey cement, flat",
    "tiling": {
      "worldSize": [
        3,
        3
      ]
    },
    "physical": {
      "roughnessFactor": 0.55,
      "metallicFactor": 0
    },
    "finish": {
      "roughness": [
        0.5,
        0.6
      ],
      "grain": 0.15,
      "relief": 1.6
    },
    "variants": 2
  },
  {
    "key": "cyberpunk/floor-slab/high_rich",
    "aliases": [
      "cyberpunk/balcony-slab/high_rich"
    ],
    "alignment": "tile",
    "description": "polished black granite floor surface seen straight from above, faint mirror sheen, deep graphite",
    "tiling": {
      "worldSize": [
        3,
        3
      ]
    },
    "physical": {
      "roughnessFactor": 0.5,
      "metallicFactor": 0
    },
    "finish": {
      "roughness": [
        0.46,
        0.56
      ],
      "grain": 0.1,
      "relief": 1.2
    },
    "variants": 2
  }
]
