[
  {
    "key": "cyberpunk/sidewalk/poor",
    "alignment": "tile",
    "description": "large rectangular pavement slabs with visible joints",
    "tiling": {
      "worldSize": [
        3,
        3
      ]
    },
    "physical": {
      "roughnessFactor": 0.95,
      "metallicFactor": 0
    },
    "variantId": "slab",
    "seed": 4200,
    "resolution": [
      1024,
      1024
    ],
    "pattern": {
      "kind": "slab",
      "colors": [
        "#3a3b3d"
      ],
      "cells": [
        3,
        3
      ],
      "line": 0.012,
      "bevel": 0.008,
      "depth": 0.5,
      "joint": 0.5,
      "grain": 0.03,
      "variation": 0.11
    }
  },
  {
    "key": "cyberpunk/sidewalk/poor",
    "alignment": "tile",
    "append": true,
    "description": "pavement slabs laid in a running bond",
    "variantId": "bond",
    "seed": 4201,
    "resolution": [
      1024,
      1024
    ],
    "pattern": {
      "kind": "slab",
      "colors": [
        "#3a3b3d"
      ],
      "cells": [
        3,
        4
      ],
      "bond": "running",
      "line": 0.012,
      "bevel": 0.008,
      "depth": 0.5,
      "joint": 0.5,
      "grain": 0.03,
      "variation": 0.13
    }
  },
  {
    "key": "cyberpunk/sidewalk/poor",
    "alignment": "tile",
    "append": true,
    "description": "oversized pavement plates with wide chamfered joints",
    "variantId": "plate",
    "seed": 4202,
    "resolution": [
      1024,
      1024
    ],
    "pattern": {
      "kind": "slab",
      "colors": [
        "#3a3b3d"
      ],
      "cells": [
        2,
        2
      ],
      "line": 0.022,
      "bevel": 0.014,
      "depth": 0.55,
      "joint": 0.55,
      "grain": 0.025,
      "variation": 0.09
    }
  },
  {
    "key": "cyberpunk/sidewalk/mid",
    "alignment": "tile",
    "description": "large rectangular pavement slabs with visible joints",
    "tiling": {
      "worldSize": [
        3,
        3
      ]
    },
    "physical": {
      "roughnessFactor": 0.9,
      "metallicFactor": 0
    },
    "variantId": "slab",
    "seed": 4210,
    "resolution": [
      1024,
      1024
    ],
    "pattern": {
      "kind": "slab",
      "colors": [
        "#45474a"
      ],
      "cells": [
        3,
        3
      ],
      "line": 0.012,
      "bevel": 0.008,
      "depth": 0.5,
      "joint": 0.5,
      "grain": 0.03,
      "variation": 0.11
    }
  },
  {
    "key": "cyberpunk/sidewalk/mid",
    "alignment": "tile",
    "append": true,
    "description": "pavement slabs laid in a running bond",
    "variantId": "bond",
    "seed": 4211,
    "resolution": [
      1024,
      1024
    ],
    "pattern": {
      "kind": "slab",
      "colors": [
        "#45474a"
      ],
      "cells": [
        3,
        4
      ],
      "bond": "running",
      "line": 0.012,
      "bevel": 0.008,
      "depth": 0.5,
      "joint": 0.5,
      "grain": 0.03,
      "variation": 0.13
    }
  },
  {
    "key": "cyberpunk/sidewalk/mid",
    "alignment": "tile",
    "append": true,
    "description": "oversized pavement plates with wide chamfered joints",
    "variantId": "plate",
    "seed": 4212,
    "resolution": [
      1024,
      1024
    ],
    "pattern": {
      "kind": "slab",
      "colors": [
        "#45474a"
      ],
      "cells": [
        2,
        2
      ],
      "line": 0.022,
      "bevel": 0.014,
      "depth": 0.55,
      "joint": 0.55,
      "grain": 0.025,
      "variation": 0.09
    }
  },
  {
    "key": "cyberpunk/sidewalk/rich",
    "alignment": "tile",
    "description": "large rectangular pavement slabs with visible joints",
    "tiling": {
      "worldSize": [
        3,
        3
      ]
    },
    "physical": {
      "roughnessFactor": 0.85,
      "metallicFactor": 0
    },
    "variantId": "slab",
    "seed": 4220,
    "resolution": [
      1024,
      1024
    ],
    "pattern": {
      "kind": "slab",
      "colors": [
        "#4f5257"
      ],
      "cells": [
        3,
        3
      ],
      "line": 0.012,
      "bevel": 0.008,
      "depth": 0.5,
      "joint": 0.5,
      "grain": 0.03,
      "variation": 0.11
    }
  },
  {
    "key": "cyberpunk/sidewalk/rich",
    "alignment": "tile",
    "append": true,
    "description": "pavement slabs laid in a running bond",
    "variantId": "bond",
    "seed": 4221,
    "resolution": [
      1024,
      1024
    ],
    "pattern": {
      "kind": "slab",
      "colors": [
        "#4f5257"
      ],
      "cells": [
        3,
        4
      ],
      "bond": "running",
      "line": 0.012,
      "bevel": 0.008,
      "depth": 0.5,
      "joint": 0.5,
      "grain": 0.03,
      "variation": 0.13
    }
  },
  {
    "key": "cyberpunk/sidewalk/rich",
    "alignment": "tile",
    "append": true,
    "description": "oversized pavement plates with wide chamfered joints",
    "variantId": "plate",
    "seed": 4222,
    "resolution": [
      1024,
      1024
    ],
    "pattern": {
      "kind": "slab",
      "colors": [
        "#4f5257"
      ],
      "cells": [
        2,
        2
      ],
      "line": 0.022,
      "bevel": 0.014,
      "depth": 0.55,
      "joint": 0.55,
      "grain": 0.025,
      "variation": 0.09
    }
  },
  {
    "key": "cyberpunk/sidewalk/high_rich",
    "alignment": "tile",
    "description": "large rectangular pavement slabs with visible joints",
    "tiling": {
      "worldSize": [
        3,
        3
      ]
    },
    "physical": {
      "roughnessFactor": 0.8,
      "metallicFactor": 0
    },
    "variantId": "slab",
    "seed": 4230,
    "resolution": [
      1024,
      1024
    ],
    "pattern": {
      "kind": "slab",
      "colors": [
        "#5a5e64"
      ],
      "cells": [
        3,
        3
      ],
      "line": 0.012,
      "bevel": 0.008,
      "depth": 0.5,
      "joint": 0.5,
      "grain": 0.03,
      "variation": 0.11
    }
  },
  {
    "key": "cyberpunk/sidewalk/high_rich",
    "alignment": "tile",
    "append": true,
    "description": "pavement slabs laid in a running bond",
    "variantId": "bond",
    "seed": 4231,
    "resolution": [
      1024,
      1024
    ],
    "pattern": {
      "kind": "slab",
      "colors": [
        "#5a5e64"
      ],
      "cells": [
        3,
        4
      ],
      "bond": "running",
      "line": 0.012,
      "bevel": 0.008,
      "depth": 0.5,
      "joint": 0.5,
      "grain": 0.03,
      "variation": 0.13
    }
  },
  {
    "key": "cyberpunk/sidewalk/high_rich",
    "alignment": "tile",
    "append": true,
    "description": "oversized pavement plates with wide chamfered joints",
    "variantId": "plate",
    "seed": 4232,
    "resolution": [
      1024,
      1024
    ],
    "pattern": {
      "kind": "slab",
      "colors": [
        "#5a5e64"
      ],
      "cells": [
        2,
        2
      ],
      "line": 0.022,
      "bevel": 0.014,
      "depth": 0.55,
      "joint": 0.55,
      "grain": 0.025,
      "variation": 0.09
    }
  }
]
