{
  "key": "cyberpunk/interior-damaged-ceiling/poor",
  "alignment": "tile",
  "description": "Continuous metric composite surface; complete panel divisions are supplied by fitted geometry",
  "tiling": {
    "worldSize": [
      2,
      2
    ]
  },
  "resolution": [
    1024,
    1024
  ],
  "variantId": "field",
  "physical": {
    "metallicFactor": 0,
    "roughnessFactor": 0.79
  },
  "pattern": {
    "kind": "composite",
    "colors": [
      "#41494b",
      "#242b2b"
    ],
    "axis": "y",
    "depth": 0.36,
    "grain": 0.08,
    "variation": 0.1,
    "sheen": 0.1,
    "wear": 1
  },
  "layout": {
    "family": "continuous",
    "origin": [
      0,
      0
    ],
    "orientation": "isotropic"
  },
  "seed": 2417,
  "overwrite": true
}
